joke,semantic_word_1,semantic_word_2,semantic_word_3
"what is the thinnest book in the world? ""what men know about women""",what,,
i worked myself up from nothing to a state of extreme poverty.,i,nothing,
"what did the stamp say to the envelope on valentine's day? ""i am stuck on you!""",what,i,you
all men are idiots...and i married their king.,all,i,
i took an iq test and the results were negative.,i,,
you are one well-defined function!,you,,
time may be a great healer but it has / it is also a lousy beautician.,,,
"cake is the answer, no matter the question.",no,,
why does the bride always wear white? because it is good for the dishwasher to match the stove and refrigerator.,why,,
"i had / i would love to go out with you, but my favorite commercial is on tv.",i,you,my
"she is not my reward, i am her punishment.",not,i,
"did adam and eve ever have a date? no, but they had an apple.",no,,
a woman is like a suitcase: both hard to carry and a pity to throw away.,both,throw away,
you can do more with a kind word and a gun than with just a kind word.,you,,
"god grades on the cross, not the curve.",not,,
you are not old until a teenager describes you as middle-aged.,you,not,
"there are drunk bikers. there are old bikers. there are no old, drunk bikers.",no,,
"why are there 5 syllables in the word ""monosyllabic""?",why,,
and in her smile i see something more beautiful than the stars.,i,,
some people only gets called by their nicknames. usually it sounds weird to even say their real name.,only,,
transitional age is when during a hot day you do not know what you want ice cream or beer.,you,do not,
"hi there, i am a human being! how about you?",i,you,
why do women always ask questions that have no right answers?,always,no,
you never lose by loving. you always lose by holding back.,never,you,
when i was young i did stupid things because i did not know any better. now i know better and do stupid things because i miss being young.,i,did not,any
what has four legs but can not walk? a chair.,what,can not,
the miss universe pageant is fixed. all the winners are from earth.,all,,
"i used to be in a band, we were called 'lost dog'. you probably saw our posters.",i,you,
"everything is edible, some things are only edible once.",everything,only,
"would you send your son to a school run by someone who insisted on being called ""headmaster?""",you,who,
"money can not buy happiness, but it can help you look for it quicker, in a convertible.",can not,you,
a man says: i do not scare easily. his pregnant wife answers: all four of our daughters will be teenagers at the same time. the man says: never stops screaming*,do not,all,never
"i heard the next steve jobs movie will be on imax. it has / it is the same movie, just on a bigger screen.",i,same,
my best toys run on batteries,my,,
it has / it is not what man can create it has / it is what man can become.,not,what,
that moment when you laugh so much about your friends joke you end up farting accidently.,you,,
i need more than 140 characters to tell you how beautiful you are.,i,you,
what did the boy bird say to the girl bird on valentine's day? let me call you tweet heart!,what,me,you
i really lack the words to compliment myself today.,i,myself,
you are so beautiful that last night you made me forget my pickup line.,you,me,
what goes up and never comes down? your age!,what,never,your
being an ugly girl is like being a man...… you have to work,you,,
you have enough fat to make another human.,you,another,
losing a husband can be hard: in my case it was almost impossible.,my,,
appreciate how some people do not come out of atm till they find the meaning of life right there.,how,do not,
discretion is being able to raise your eyebrow instead of your voice.,your,,
be safety conscious. 80% of people are caused by accidents.,,,
women with pasts interest men... they hope history will repeat itself.,repeat,,
why do bachelors like smart women? because they are so rare.,why,,
why do men find it difficult to make eye contact? they are trying not to attract any more undue blame then they already have.,why,not,
why do dogs make good sailors? they know their knots.,why,,
what is the population of antarctica. all white.,all,,
i have all the money i shall / i will ever need if i die by 4:00 p.m. today.,i,all,
"just about the time when you think you can make ends meet, somebody moves the ends.",you,moves,
let us both be naughty this year and save santa the trip.,,,
what do you call a black guy who goes to college? a basketball player.,what,who,
what has / what is the difference between men and pigs? pigs do not turn into men when they drink.,between,do not,
what do elves learn in school? the elf-abet!,what,,
why are aspirins white? because they work.,why,,
he always finds himself lost in thought; it has / it is unfamiliar territory.,,,
every wife should understand one thing: a dinner will taste better if she cooks it less frequently.,every,,
young riders pick a destination and go... old riders pick a direction and go.,,,
currently the flower business is blooming.,,,
"it is said that, you can not buy happiness. you only need to know the right places...",can not,only,you
"if i freeze, it has / it is not a computer virus. i was just stunned by your beauty.",i,not,your
"i do not care how old i am, i will see finding dory.",i,do not,
a wife is like a boomerang the harder you throw the faster she comes back.,you,,
if a wife is silent and not arguing it means she has / she is sleeping.,not,,
remember: you can eat your way out of almost any problem.,remember,you,any
"if love is the answer, could you rephrase the question?",you,,
"i never could bring a woman into my house. at first, because of the parents. later, because of the wife.",i,never,my
i wish there was a way to keep in touch with dogs i meet outside of grocery stores.,i,outside,
every day two million americans play tennis and one million of them lose.,every,,
i am experiencing heavy call volumes. please hang up and never call me again.,i,never,me
i was such an ugly kid. when i played in the sandbox the cat kept covering me up.,i,when,me
the national debt is not the only thing that has / that is rising.,is not,only,
what is better than a cold bud? a warm bush.,what,,
girls are like internet domain names... the ones i like are already taken.,i,,
my doctor told me i needed to break a sweat once a day so i told him i had / i would start lying to my wife.,my,i,
what do farmers give their wives on valentine's day? hog and kisses!,what,,
"if the facts do not fit the theory, change the facts.",do not,,
"throwing acid is wrong, in some people's eyes.",,,
you do not need a parachute to skydive. you only need a parachute to skydive twice.,you,not,only
i love waking up to the sound of birds arguing with their spouses.,i,,
"to be sure of hitting the target, shoot first and call whatever you hit the target.",whatever,you,
you are such a good friend that if we were on a sinking ship together and there was only one life jacket ... i had / i would miss you heaps and think of you often.,you,only,i
"i was not lying, i was just writing fiction with my mouth.",i,was not,
what do you get from a pampered cow? spoiled milk.,what,you,
how is a man like the weather? nothing can be done to change either one of them.,how,nothing,
apple should make a sarcasm font and call it the iroll.,,,
it has / it is always a good idea to make friends with babies. that has / that is free cake once a year for a lifetime.,always,,
why do we press harder on a remote control when we know the batteries are getting weak?,why,we,
"unless you are the lead dog, the view never changes.",you,never,
what part of a football ground is never the same? the changing rooms.,what,never,same
"i know its not christmas, but santa's lap is always ready.",not,always,
trying to understand women is like trying to smell color 9.,,,
"why do only 10% of men make it to heaven? because if they all went, it would be hell.",why,only,all
life is tough enough without having someone kick you from the inside.,without,you,
did you know that santa's not allowed to go down chimneys this year? it was declared unsafe by the elf and safety commission.,not,,
"two snowmen in a field, one turned to the other and said ""i do not know about you but i can smell carrots!""",i,do not,you
god must love stupid people. he made so many.,so many,,
wine improves with age. i improve with wine.,i,,
how do you turn a fox into an elephant? marry it!,how,you,
"men, if you have met your dream girl, materialize her.",you,,
"""could you take a couple steps back. i have a nut allergy.""",you,back,
"if you were a browser, you had / you would be called firefoxy.",you,,
"if i was the grinch, i would not steal christmas. i had / i would steal you.",i,would not,you
"why is psychoanalysis a lot quicker for men than for women? when it has / it is time to go back to his childhood, he has / he is already there.",why,back,
when they start getting the 5-day forecast right then maybe i shall / i will listen to their climate change theories.,i,,
love is an ocean of emotions entirely surrounded by expenses.,entirely,,
"instead of getting married again, i am going to find a woman i do not like and give her a house.",i,do not,
i got drunk last night and my house was not where i left it.,i,was not,
"hey baby, if i supply the voltage and you some resistance, imagine the current we can make together.",i,you,together
the longer you sleep the more sleep you need. the more you eat the bigger is your appetite.,longer,you,
"if i was smarter, i would know so much more stuff.",i,so much,
time does not exist. clocks exists.,does not,,
welcome to twitter - if you are not already following a mom who drinks wine one will be assigned to you.,you,not,who
did you hear about the nearsighted porcupine? he fell in love with a pincushion!,you,,
take time to relax especially when you do not have time for it.,you,do not,
"if you want to hide your face, go out naked.",you,,
"when you choke a smurf, what color does it turn?",you,,
why do you need a driver's license to buy liquor when you can not drink and drive?,why,you,can not
hard to take women with false eyelashes seriously. it has / it is like watching two tarantulas scream for attention.,,,
i like work. it fascinates me. i sit and look at it for hours.,i,me,
"hallmark card: ""i am so miserable without you, it has / it is almost like you are still here.""",i,without,you
the last thing on earth you want to do will be the last thing you do.,you,,
those that forget the pasta are doomed to reheat it.,,,
what the difference between fiction and reality? fiction has to make sense.,between,,
do you want to speak to the manager or someone who know's what has / what is going on?,you,who,
a committee is twelve men doing the work of one.,,,
"my five-year-old kid said: ""i do not want to be your daughter anymore. i quit!"" no two-week notice or anything. she had / she would better not expect a reference.",do not,,
alcohol not only expands the blood vessels but also communications.,not,,
"if i wanted to get trapped in a scary maze, i had / i would just go into my kid's bedroom.",i,my,
my room and internet connection and music and food homework equals to a perfect day.,my,,
be nice to your kids. they shall / they will choose your nursing home.,your,,
where were you? i have been waiting for half an hour. the girl never said that.,you,i,never
what kind of motorbike does santa ride? a holly davidson!,,,
"you can never lose a homing pigeon - if your homing pigeon does not come back, what you have lost is a pigeon.",you,never,does not
i think i have discovered my supersymmetric partner.,i,my,
breaking: man takes longer to find emoji than it would have taken him to find words that convey what he wanted.,longer,what,
i went to a peanut factory last week. it was nuts!,i,,
what did god say after creating man? i must be able to do better than that.,what,i,
"in my experience there has / there is two ways to get things done, the right way and the drunk way.",my,,
middle age is when work is a lot less fun and fun a lot more work.,when,a lot,
oh... sorry... did you mistake me for someone who cares?,you,who,
there are a lot of female hormones in beer. when i drink five bottles i also can not drive a car and start behaving illogically.,i,can not,
politics is just show business for ugly people.,,,
"if you do not like my opinion of you, improve yourself!",you,do not,my
spent 15 min tracing a suspicious noise that tuned out to be the lid not screwed on the coke bottle tightly enough.,not,,
i am sure there has / there is a supplement i could take or another easy solution to cure my laziness. someone look into it for me.,i,another,me
it has / it is not love until you do not want them to have a good time without you.,not,you,without
laziness level: i get jealous when it has / it is bedtime in other countries,i,,
useless trying to undo a mistake. focus your efforts on new ones.,your,,
my wine drinking is merely functional... my personality is better with a little marinade.,my,,
"it probably seems like i am listening to your story, but i am really thinking, ""close your fucking menu or the waiter will never come over.""",i,your,never
"my son just asked me if cats can have babies when they are not / am not married and i told him yes, but i honestly do not know.",my,are not / am not,i
i am not sure if this woman in the starbucks line ahead of me is ordering a drink or casting a spell.,not,,
april fools' day is like a huge open mic night in which millions of people go out of their way to demonstrate how unfunny they are.,,,
how do you fix a woman's watch? why should you? there has / there is a clock on the oven.,how,you,
"tomorrow is april fools day. believe nothing, and trust no one. ""so it has / it is like any other day.""",nothing,no,any
i do not date older women because it takes too long to listen to their life story.,do not,long,
"you were beautiful in my dreams, but a fucking nightmare in reality.",you,my,
"sorry i just saw your text from last night, are you guys still at the restaurant.",i,your,
a woman is like a shadow: when you walk from behind she runs away. when you run from her follows you behind.,you,behind,
you must be peanut butter because you are making my legs feel like jelly.,you,my,
"do not feel sad, do not feel blue, frankenstein was ugly too.",do not,,
you know youre fifty when your chiropractor sends you birthday cards.,you,,
a retired husband is often a wife's full-time job.,,,
what has a whole bunch of little balls and screws old ladies? a bingo machine.,what,whole,
you have the right to remain silent because whatever you say will probably be stupid anyway.,you,whatever,
marriage is like a bar of soap. it smells delicious until you take a bite out of it!,you,,
you can not know a person well until you live with them. you can not know them really well until you divorce them.,you,can not,
sports do not build character. they reveal it.,not,,
what happened to the egg when he was tickled too much? he cracked up.,what,too much,
getting a red heart instead of a yellow star makes me feel like things are moving a little too fast between us.,me,us,
"a bank is a place that will lend you money, if you can prove that you do not need it.",you,do not,
computer does what you command him to do but not what you want from him.,you,not,
you are the reason santa even has a naughty list.,you,,
"what did one candle say to the other? ""do not birthdays burn you up?""",what,do not,
there were plenty of lookers-on but no witnesses.,no,,
"i wanted to tell you that wherever i am, whatever happens, i shall / i will always think of you, and the time we spent together, as my happiest time. i had / i would do it all over again, if i had the choice. no regrets.",i,you,always
what should you do if you see your ex-husband rolling around in pain on the ground? shoot him again.,what,you,
"becoming a father is easy enough, but being one can be very rough.",very,,
you never have to worry about love at first sight if you steadfastly keep looking at your phone.,you,never,
"it has / it is better to be a worldwide alcoholic, than an alcoholic anonymous.",,,
sugar - honey - iced - tea ... guess what it means.,,,
there are 364 days until christmas and people already have their christmas lights up. unbelievable...,unbelievable,,
my neighbors are listening to great music. whether they like it or not.,my,not,
the only reason i have been going out with this guy all summer is because i have no idea how to operate my gas grill.,only,i,no
"a lot of people are afraid of heights. not me, i am afraid of widths.",not,i,
i had / i would advise you graduates to keep your graduation gown. it has / it is the only outfit you might not outgrow.,i,your,not
"how do i stay humble? well, it has / it is not easy, but i start by being generally bad at almost all things.",how,not,all
"the question is not at what age i want to retire, it has / it is at what income.",is not,i,
what has / what is the difference between batman and a black man? batman can go into a store without robin.,between,without,
"what goes ""oh oh oh""? santa walking backwards.",what,,
"the best way to remember your 21st birthday, is not at all. have fun blacking out.",remember,not,
a tip to a young housewife: remember that a small bottle of vodka not only will decorate the table but also will hide your cooking mistakes.,remember,,
do you think they named april fool's day in your honor?,you,your,
a beautiful girl looks good in the background of her smart friend.,,,
say what you want about deaf people...,what,,
"diet tip: if you think you are hungry, you might just be thirsty. have a bottle of wine first and then see how you feel.",you,how,
twitter is my 'serious' account. my bank account is the 'joke' one.,my,,
everybody is somebody else's weirdo.,everybody,,
"if she says, ""i am ok,"" you are fine. if she says, ""i am fine,"" you are not ok.",i,you,not
"i ran three miles today. finally i said, ""lady take your purse.""",i,your,
what has / what is the difference between light and hard? you can sleep with a light on.,what,between,you
legends do not die... i am a living example!,do not,i,
what happened when the man fell in love with his garden? it made him wed his plants!,what,,
"she said she was approaching forty, and i could not help wondering from what direction.",i,could not,what
"i bet egyptians were all like ""yo, nobody in history will ever worship and revere cats like we do"" and then came the internet.",i,all,nobody
he has / he is a recovering alcoholic: recovering from last night!,,,
it was love at first sight. then i took a second look!,,,
it has / it is gonna be ok.,,,
"the first time i got a universal remote control, i thought to myself ""this changes everything"".",i,everything,
"i intend to live forever. so far, so good.",i,,
who invented the brush they put next to the toilet? that thing hurts!,who,,
out of my mind. back in five minutes.,my,,
save the whales. collect the whole set.,,,
he who hesitates is boss.,who,,
beer: it has / it is not just for breakfast anymore.,not,,
what do eskimos get from sitting on the ice too long? polaroids.,what,long,
why did not cupid shoot his arrow at the lawyer's heart? because even cupid can not hit a target that small.,why,can not,small
why do gorillas have big nostrils? because they have big fingers.,why,,
arguing with women just like arguing with a forest fire.,,,
"""why do not you trust me?"", she texted both the guys simultaneously.",why,,
"if google ever goes down and stays down, i am fucked. i know four facts and they are all about elephants and i already forgot three of them.",i,,
"money can not buy happiness, but it sure makes misery easier to live with.",can not,,
how does a farmer count cows? with a cow-calculator.,how,,
"you are like milk, i want to make you a part of my complete breakfast.",i,you,my
i love the way you move...like butter on a bald monkey.,i,you,
my hope for you is that you someday find the end of your sentence,my,you,your
never agree to plastic surgery if the doctor's office is full of portraits by picasso.,never,,
"i do not want you to feel like you can not express yourself, but i do want you to stop talking.",do not,can not,yourself
"your name must be coca cola, because you are so-da-licious",your,,
my love for you is like a fart. everything about it is powered by my heart.,my,you,everything
my coworker who believes jesus christ was the immaculately conceived son of god who rose from the dead can not believe it has / it is monday already.,my,who,can not
"do not walk behind me, for i may not lead. do not walk ahead of me, for i may not follow. do not walk beside me either. just pretty much leave me the hell alone.",not,me,
i bought a new japanese car. i turned on the radio... i do not understand a word they are saying.,i,do not,
what do bees do with their honey? they cell it.,what,,
"you would never be able to live down to your reputation, but i see you are doing your best.",you,never,i
"a wife in big doses is poison, in small doses medicine.",big,small,
"your kid may be an honors student, but you are still an idiot.",your,,
i am so introverted i will not even talk to myself.,i,will not,myself
"it has / it is not a flaw to have a husband, but an essential drawback to have a wife.",not,,
why do not men have mid-life crises? they stay stuck in adolescence.,why,,
what is the difference between a dog and a fox? about 5 drinks,what,between,
how about we do some peer-to-peer sharing? your domain or mine?,we,your,
should crematoriums give discounts for burn victims?,,,
"dear lord, there is a bug in your software...it's called monday, please fix it...",your,,
wanna meet santa's little helper?,,,
you are so poor. i saw you kicking a can across the street i asked you what you were doing you said moving.,you,i,
"baby, let us configure our hard drives in master and slave position.",our,,
the best reason to divorce or break-up with a man is for health reasons you are sick of him.,you,,
"if the number 2 pencil is the most popular, why is it still number 2?",most,why,
man's appearance is not the most important thing. there are worse flows.,not,,
"women dream of world peace, a safe environment, and eliminating hunger. what do men dream of? being stuck in an elevator with the doublemint twins.",what,,
you are not sure outrun and make sure.,not,,
"if breaks are meant to be slow... then why do they call it ""breakfast""?",why,,
"i am a humble person, really. i am actually much greater than i think i am.",i,much,
"the easiest job in the world has to be coroner. surgery on dead people. what has / what is the worst thing that could happen? if everything went wrong, maybe you had / you would get a pulse.",what,everything,you
"if everything seems to be coming your way, you are probably in the wrong lane.",everything,your,
"i do not care who you are, but if you are reading this i still do not care.",do not,you,i
"why do women have smaller feet than men? it has / it is one of those ""evolutionary things"" that allows them to stand closer to the kitchen sink.",why,,
how can you tell which is the head nurse? the one with the dirty knees.,how,,
a man can be happy with any woman as long as he does not love her.,any,does not,
"i was never a photogenic person, because when everyone said cheese i said ""where""?",never,everyone,i
"always wear high heels, it makes it easier to look down on him.",always,,
why did not noah swat those two mosquitoes?,why,,
how do you get a nun pregnant? dress her up as an alter boy.,how,,
"you should know, that no one understood it was an april fool's joke because no one expected you have a sense of humor.",you,no,you
my wife set a limit on how much we can spend on each other for christmas. it has / it is $100 on me and $500 on her.,my,we,me
you smell like trash..... can i take you out?,you,,
no matter what has happened. no matter what you have done. no matter what you will do. i will always love you. i swear it.,no,what,i
"if you love a woman, you should not be ashamed to show her to your wife.",you,should not,
why do men need instant replay on tv sports? because after 30 seconds they forget what happened.,why,what,
everything is rightly confused.,everything,,
careful! angry dog in the backyard! please do not crush him.,not,,
i bet we can get into some serious treble together.,i,together,
"i do not have a solution, but i do admire the problem.",do not,i,
"being a great father is like shaving. no matter how good you shaved today, you have to do it again tomorrow.",no matter how,you,
tarzan does not have a beard. yet he lives in the jungle for over 30 years.,does not,,
twitter is just linkedin for the chronically unemployed.,,,
a bargain is something you do not need at a price you can not resist.,do not,you,
a bus is a vehicle that runs twice as fast when you are after it as when you are in it.,you,,
"i have been on so many blind dates, i should get a free dog.",i,,
a hard thing about a business is minding your own.,your,,
"does your skin feel burnt? because i think you must have just fallen down from heaven, and re-entry gave you a tan.",your,i,
the qualities that most attract a woman to a man are usually the same ones she can not stand years later.,most,can not,
do you know any bird that can write? pen-guine.,you,,
we are all part of the ultimate statistic ten out of ten die.,we,all,
ready for the only way to enjoy instagram? follow zero people. follow every dog.,every,,
what is life? life is love. whats love? love is kissing. whats kissing? come here and i show you.,what,you,
what do you do when you are sitting in the dark and your tv starts to float? you turn on the lights and shoot the black guy stealing it.,what,you,
i hate the part of the conversation where the other person says things.,i,,
nothing spoils the target more than a hit.,nothing,,
