joke,semantic_word_1,semantic_word_2,semantic_word_3
i just asked my husband if he remembers what today is... scaring men is easy.,remembers,scaring,
"people used to laugh at me when i would say ""i want to be a comedian"", well nobody is laughing now.",laugh,nobody,
today a man knocked on my door and asked for a small donation towards the local swimming pool. i gave him a glass of water.,knocked,i,
my wife and i were happy for twenty years. then we met.,my,we,
"if i had a dollar for every girl that found me unattractive, they would eventually find me attractive.",every,me,
"just read that 4,153,237 people got married last year, not to cause any trouble but should not that be an even number?",any,,
you know you are ugly when it comes to a group picture and they hand you the camera.,you,,
a recent study has found that women who carry a little extra weight live longer than the men who mention it.,a little,who,
relationships are a lot like algebra. have you ever looked at your x and wondered y?,a lot,you,
life is all about perspective. the sinking of the titanic was a miracle to the lobsters in the ship's kitchen.,all,,
"intelligence is like an underwear. it is important that you have it, but not necessary that you show it off.",you,not,
"life is like toilet paper, you are either on a roll or taking shit from some asshole.",you,or,
is not it great to live in the 21st century? where deleting history has become more important than making it.,more,,
"feeling pretty proud of myself. the sesame street puzzle i bought said 3-5 years, but i finished it in 18 months.",myself,i,
"i want to die peacefully in my sleep, like my grandfather.. not screaming and yelling like the passengers in his car.",my,,
"when wearing a bikini, women reveal 90 % of their body... men are so polite they only look at the covered parts.",look at,,
"when my boss asked me who is the stupid one, me or him? i told him everyone knows he does not hire stupid people.",my,everyone,does not
my favorite mythical creature? the honest politician.,my,,
"i am great at multitasking. i can waste time, be unproductive, and procrastinate all at once.",i,all,
strong people do not put others down. they lift them up and slam them on the ground for maximum damage.,do not,lift,
"if you can smile when things go wrong, you have someone in mind to blame.",you,in mind,
"before i criticize a man, i like to walk a mile in his shoes. that way, when i do criticize him, i am a mile away and i have his shoes.",i,,
"the 50-50-90 rule: anytime you have a 50-50 chance of getting something right, there has / there is a 90% probability you shall / you will get it wrong.",you,wrong,
take my advice i am not using it.,my,not,
you know that tingly little feeling you get when you like someone? that has / that is your common sense leaving your body.,you,leaving,
how do i disable the autocorrect function on my wife?,i,,
"you are not fat, you are just... easier to see.",you,not,
i can totally keep secrets. it has / it is the people i tell them to that can't.,totally,can not,
apparently i snore so loudly that it scares everyone in the car i am driving.,i,everyone,
"politicians and diapers have one thing in common. they should both be changed regularly, and for the same reason.",one,same,
"when miley cyrus gets naked & licks a hammer, it has / it is ""art"" & ""music"". but when i do it, i am ""drunk"" and ""have to leave the hardware store"".",i,leave,
"that awkward moment when you leave a store without buying anything and all you can think is ""act natural, you are innocent"".",you,anything,
"alcohol is a perfect solvent: it dissolves marriages, families and careers.",,,
"if you think nobody cares whether you are alive, try missing a couple of payments.",you,nobody,
my therapist says i have a preoccupation with vengeance. we will see about that.,i,see,
"i used to think i was indecisive, but now i am not too sure.",i,not,
i think my neighbor is stalking me as she has / she is been googling my name on her computer. i saw it through my telescope last night.,me,saw,
"i have been repeating the same mistakes in life for so long now, i think i shall / i will start calling them traditions.",i,think,
"did you know that dolphins are so smart that within a few weeks of captivity, they can train people to stand on the very edge of the pool and throw them fish?",you,throw,
"when an employment application asks who is to be notified in case of emergency, i always write, ""a very good doctor"".",who,i,very
"i am not saying i hate you, but i would unplug your life support to charge my phone.",not,unplug,
money talks ...but all mine ever says is good-bye.,mine,,
team work is important; it helps to put the blame on someone else.,put,,
"i changed my password to ""incorrect"". so whenever i forget what it is, the computer will say ""your password is incorrect"".",my,your,
i bought a vacuum cleaner six months ago and so far all it has / it is been doing is gathering dust.,i,ago,
"there are two rules for success: firstly, do not tell all you know.",do not,you,
"i asked god for a bike, but i know god does not work that way. so i stole a bike and asked for forgiveness.",i,does not,
"i started out with nothing, and i still have most of it.",i,nothing,
"any married man should forget his mistakes, there has / there is no use in two people remembering the same thing.",no,same,
"my wife is so negative. i remembered the car seat, the stroller, and the diaper bag. yet all she can talk about is how i forgot the baby.",my,remembered,all
artificial intelligence is no match for natural stupidity.,no,,
funny how they say we need to talk when they really mean you need to listen.,how,you,
"two wrongs do not make a right, take your parents as an example.",do not,your,
never laugh at your girlfriends choices... you are one of them.,never,you,
entered what i ate today into my new fitness app and it just sent an ambulance to my house.,i,my,
love is telling someone to go to hell and worrying about them getting there safely.,go,,
"i sometimes watch birds and wonder ""if i could fly who would i shit on?""",watch,fly,
"the difference between ""girlfriend"" and ""girl friend"" is that little space in between we call the ""friend zone"".",between,we,
women spend more time wondering what men are thinking than men spend thinking.,thinking,,
my son asked me what it has / it is like to be married? so i told him to leave me alone and when he did i asked him why he was ignoring me.,me,leave,why
i hate when i am about to hug someone really sexy and my face hits the mirror.,i,hug,
if you see me smiling it has / it is because i am thinking of doing something evil or naughty. if you see me laughing it has / it is because i have already done it.,you,thinking,
if i wanted to kill myself i had / i would climb your ego and jump to your iq.,kill,your,
"thanks for explaining the word ""many"" to me, it means a lot.",me,,
good health is merely the slowest possible rate at which one can die.,,,
i had / i would like to see things from your point of view but i can not seem to get my head that far up my ass.,your,can not,
why is google a woman? because it will not let you finish your sentence without coming up with other suggestions.,why,,
when i call a family meeting i turn off the house wifi and wait for them all to come running.,i,all,
"if you are not supposed to eat at night, why is there a light bulb in the refrigerator?",not,why,
"dear alcohol, we had a deal where you would make me funnier, smarter, and a better dancer... i saw the video... we need to talk.",we,you,
"when i told the doctor about my loss of memory, he made me pay in advance.",i,my,
there are three kinds of people: those who can count and those who can't.,can,can not,
improve your memory by doing unforgettable things.,improve,,
"when i see ads on tv with smiling, happy housewives using a new cleaning product, the only thing i want to buy are the meds they must be on.",i,only,
a conclusion is the part where you got tired of thinking.,you,,
a good wife always forgives her husband when she has / she is wrong.,,,
"if i ever need a heart transplant, i had / i would want my ex's. it has / it is never been used.",,never,
my new year's resolution is to help all my friends gain ten pounds so i look skinnier.,my,all,
an optimist believes that we live in the best world. a pessimist is afraid that it might be true.,we,,
whatever you do always give 100 %. unless you are donating blood.,whatever,you,
do not argue with an idiot. he will drag you down to his level and beat you with experience.,not,drag,you
"let me make this simple, i want to be invited but i do not want to go.",i,do not,
"a straight face and a sincere-sounding ""huh?"" have gotten me out of more trouble than i can remember.",me,remember,
"a computer once beat me at chess, but it was no match for me at kick boxing.",me,no,boxing
"if procrastionation was an olympic sport, i had / i would compete in it later.",i,,
nothing ruins a friday more than an understanding that today is tuesday.,nothing,,
"i am a nobody, nobody is perfect, therefore i am perfect.",i,nobody,
"for maximum attention, nothing beats a good mistake.",nothing,,
"regular naps prevent old age, especially if you take them while driving.",you,driving,
"i asked my wife if she ever fantasizes about me, she said yes - about me taking out the trash, mowing the lawn, and doing the dishes.",my,yes,
never tell your problems to anyone … 20% do not care and the other 80% are glad you have them...,never,anyone,you
never test the depth of the water with both feet.,never,,
"my internet is so slow, it has / it is just faster to drive to the google headquarters and ask them shit in person.",my,drive,
i have not spoken to my wife for 18 months. i do not like to interrupt her.,my,do not,
want to get noticed? go jogging without moving your arms.,moving,,
going to church does not make you a christian any more than standing in a garage makes you a car.,does not,,
"if at first you do not succeed, we have a lot in common.",do not,,
"failure is not falling down, it is not getting up again.",not,,
your family tree must be a cactus because everybody on it is a prick.,your,everybody,
"why is the day that you do laundry, cook, clean, iron and so on, called a day off?",why,,
friends wave red flags when you have a bad idea. real friends pick up a camera.,wave,,
my job is secure. no one else wants it.,no,,
it has / it is better to let someone think you are an idiot than to open your mouth and prove it.,you,open,
my ex wrote to me: can you delete my number? i responded: who is this?,me,who,
"best friends: ready to die for each other, but will fight to the death over the last slice of pizza.",,,
whoever said nothing is impossible is a liar. i have been doing nothing for years.,nothing,i,
there are few things i enjoy more than picking an argument with my girlfriend when she has the hiccups.,,,
"you are so ugly, when your mom dropped you off at school she got a fine for littering.",you,,
"i did not say it was your fault, i said i was blaming you.",did not,,
top 3 situations that require witnesses:1) crimes 2) accidents 3) marriages. need i say more?,,,
"there is a new trend in our office; everyone is putting names on their food. i saw it today, while i was eating a sandwich named kevin.",everyone,i,
a fine is a tax for doing wrong. a tax is a fine for doing well.,,,
my doctor told me that jogging could add years to my life. he was right. i feel ten years older already.,my,,
"wife: ""i look fat. can you give me a compliment?"" husband: ""you have perfect eyesight.""",you,eyesight,
i like you. you remind me of when i was young and stupid.,you,i,
escalators do not break down... they just turn into stairs.,,,
"if i had / i would shot you sooner, i had / i would be out of jail by now.",shot,i,
it is much easier to apologize than to ask permission.,,,
"my opinions may have changed, but not the fact that i am right.",my,not,
"every time you talk to your wife, your mind should remember that... 'this conversation will be recorded for training and quality purpose'",you,remember,
"i am busy contemplating my future. do not worry, this will only take a minute.",i,do not,
my wife made me into millionaire. i was a multi-millionaire before we met.,my,,
i live in constant fear that my kid will become a famous artist or painter and i will have thrown out about a trillion dollars of her work.,my,thrown,
"for every action, there is a corresponding over-reaction.",every,,
"congratulations, if you press the elevator button three times it goes into hurry mode really...",press,,
turning vegan is a big missed steak.,,,
eat right. stay fit. die anyway.,,,
you must have been born on a highway because that has / that is where most accidents happen.,you,most,
i can not believe i got fired from the calendar factory. all i did was take a day off.,can not,all,
i met my soulmate. she did not.,my,did not,
never trust a dog to watch your food.,never,,
i like to finish other people's sentences because... my version is better.,my,,
she wanted a puppy. but i did not want a puppy. so we compromised and got a puppy.,did not,i,
"i hate lying people, they are always in my way to the ocean.",i,my,
"cats spend two thirds of their lives sleeping, and the other third making viral videos.",sleeping,,
why was cinderella thrown off the basketball team? she ran away from the ball.,why,ran,
i married miss right. i just did not know her first name was always.,i,did not,
"i was not originally going to get a brain transplant, but then i changed my mind.",i,then,
adults are always asking little kids what they want to be when they grow up because they are looking for ideas.,what,,
"why is it everything i love is either unhealthy, addicting or has multiple restraining orders against me?",why,me,
i am reading a book about anti-gravity. it has / it is impossible to put down.,reading,,
if time is money. are atm's time machines?,,,
i had / i would tell you a chemistry joke but i know i would not get a reaction.,i,,
the reward for a job well done is more work.,more,,
nothing is fool proof to a sufficiently talented fool.,nothing,,
that awkward moment when you are in a meeting and your stomach decides to sound like a dying whale.,you,,
my wife and i always compromise. i admit i am wrong and she agrees with me.,my,,
my superpower is making people laugh. which would be great if i was trying to be funny.,my,,
my life is an open book. but it has / it is very poorly written and i die in the end.,my,open,
i was not born with enough middle fingers to let you know how i feel about you.,was not,you,
"refusing to go to the gym counts as resistance training, right?",,,
i am the kind of guy who stops the microwave at 1 second just to feel like a bomb defuser.,i,who,
i think that if i died and went straight to hell it would take me at least a week to realize i was not at work anymore.,i,was not,
"if laughter is the best medicine, your face must be curing the world.",your,,
"do not be irreplaceable - if you  can not be replaced, you  can not be promoted.",do not,you,
everyone has a friend who laughs funnier than he jokes.,everyone,,
never break someone's heart because they have only one inside...break their bones because they have 206 of them.,never,,
"before having a kid the most important thing to ask yourself is ""am i ready to watch the exact same cartoon on repeat for the next 4 years?""",yourself,,
why did the blond get fired from the banana plantation? because she threw out all the bent ones.,why,threw,
"dear couples who fight in public, stop trying to whisper and would it kill you to include some backstory.",whisper,,
the lesson of halloween is that pretending to be something you are not will lead to a sweet reward.,you,,
"one day you are the best thing since sliced bread. the next, you are toast.",you,,
"i saw a sign that said ""watch for children"" and i thought, ""that sounds like a fair trade"".",i,thought,
"if you really want to know about mistakes, you should ask your parents.",you,,
accidentally pooped my pants in the elevator. i am taking this shit to a whole new level.,my,whole,
did you hear about the guy who got hit in the head with a can of soda? he was lucky it was a soft drink.,hit,,
"i remember when halloween was the scariest night of the year. now, it has / it is election night.",remember,,
"you may fall from the sky, you may fall from a tree, but the best way to fall... is in love with me.",you,sky,
"moses was leading his people through the desert for 40 years. it seems, even in biblical times men avoided asking the way.",asking,,
my husband is on the roof - only a few inches away from an insurance claim that could completely change my life.,my,change,
"i am known at the gym as the ""before picture.""",i,,
"a man enters a store and says: ""15 litres of wine please."" ""did you bring a container for this?"" ""you're speaking to it.""",you,,
i was born to be a pessimist. my blood type is b negative.,i,,
i think it has / it is wrong that only one company makes the game monopoly.,i,wrong,
the only knowledge that can hurt you is the knowledge you do not have.,only,you,
"if someone hates you for no reason, give that motherfucker a reason.",you,,
the man who discovered copper died penniless.,,,
i feel like i am diagonally parked in a parallel universe.,i,,
"sometimes the first step to forgiveness, is realising the other person was born an idiot.",,,
people are making end of the world jokes. like there is no tomorrow.,no,,
where do they get the seeds to plant seedless watermelons?,where,,
the hardness of butter is directly proportional to the softness of the bread.,,,
why does it feel like time slows down during the day when you are at work and rapidly speeds up at night when you get home?,why,you,
"my girlfriends dad asked me what i do. apparently, ""your daughter"" was not the right answer.",my,what,was not
the grass may be greener on the other side but at least you do not have to mow it.,you,do not,
"the depressing thing about tennis is that no matter how good i get, i shall / i will never be as good as a wall.",i,never,
depression is merely anger without enthusiasm.,without,,
"i would give my dad what he really wants on father's day, but i can not afford to move out yet.",i,can not,
you know your children are growing up when they stop asking you where they came from and refuse to tell you where they are going.,you,refuse,
women should not have children after 35. really ... 35 children are enough.,not,enough,
"i have never understood why women love cats. cats are independent, they do not listen, they do not come in when you call, they like to stay out all night, and when they are home they like to be left alone and sleep. in other words, every quality that women hate in a man, they love in a cat.",never,do not,
"god gave us the brain to work out problems. however, we use it to create more problems.",gave,however,
"according to most studies, people's number one fear is public speaking. number two is death. death is number two. does that sound right? this means to the average person, if you go to a funeral, you are better off in the casket than doing the eulogy.",most,you,
"it has / it is funny, when i walk into a spider web i demolish his home and misplace his dinner yet i still feel like the victim.",i,yet,
"time waits for no man, time is obviously a woman.",no,,
"people say money is not the key to happiness, but i always figured if you had enough money, you can have a key made.",not,i,you
friends are forever. until they get in a relationship.,,,
"doing things that you are not supposed to do at work makes your vision, hearing and alertness much better.",not,much,
we never knew he was a drunk... until he showed up to work sober.,never,,
how do you make a blonde's eyes light up? shine a flashlight in their ear.,how,,
"children in the back seats of cars cause accidents, but accidents in the back seats of cars cause children.",,,
"one cigarette shortens your life by two hours, one bottle of vodka by three hours, and a workday eight hours.",,,
"if i had a dollar for every time you said something smart, i had / i would be broke.",i,you,
"what has / what is six inches long, two inches wide, and drives women wild? money.",what,,
"i got caught in police speed trap yesterday. the officer walked up to my car and said ""i've been waiting all day for you "" well i said. ""i got here as fast as i could.""",i,waiting,you
"a memorandum is written not to inform the reader, but to protect the writer.",not,,
is not it weird how when a cop drives by you feel paranoid instead of protected.,drives,,
"i am glad i know sign language, it has / it is pretty handy.",i,,
i do not have an attitude; i have a personality you can not handle.,do not,,
"it has / it is just a bad day, not a bad life.",just,not,
"every time i find the meaning of life, they change it.",every,i,
my mother never saw the irony in calling me a son-of-a-bitch.,my,me,
"yesterday, i fell down from a 10 meter ladder. thank god i was on the third step.",i,,
"i do not think you act stupid, i am sure it has / it is the real thing.",do not,,
"some people say ""if you can not beat them, join them"". i say ""if you can not beat them, beat them"", because they will be expecting you to join them, so you will have the element of surprise.",can not,beat,you
"i bet you $4,567.89 you can not guess how much i owe my bookie.",can not,i,
i am jealous of all the people that have not met you!,i,you,
"i was going to look for my missing watch, but i could never find the time.",i,look,
true friendship: walking into a persons house and your wifi connects automatically.,,,
i need to start paying closer attention to stuff. found out today my wife and i have separate names for the cat.,i,separate,
you have not experienced awkward until you try to tickle someone who is not ticklish.,have not,you,
"i like birthdays, but i think too many can kill you.",i,kill,
"ebay is so useless. i tried to look up lighters and all they had was 13,749 matches.",i,,
letting the cat out of the bag is a whole lot easier than putting it back in.,,,
smart people do not call themselves smart - me included.,do not,,
"i am sorry i was not part of your past, can i make it up by being in your future?",was not,your,
facts do not cease to exist because they are ignored.,not,,
what language are you speaking? cause it sounds like bullshit.,what,you,
the trouble with doing something right the first time is that nobody appreciates how difficult it was.,nobody,,
"you could very well be going to heaven, but it will not be hell in hell without you!",you,will not,
can i have your picture so i can show santa what i want for christmas?,your,show,
hit snooze until the panic sets in.,,,
it looks like your face caught on fire and someone tried to put it out with a hammer.,your,hammer,
"i always tell new hires, do not think of me as your boss, think of me as your friend who can fire you.",i,do not,you
how do you embarrass an archeologist? give him a used tampon and ask him which period it came from.,how,give,
there has / there is nothing like the joy on a kid's face when he first sees the playstation box containing the socks i got him for christmas.,nothing,,
i work to buy a car to go to work.,i,go,
"children seldom misquote you. in fact, they usually repeat word for word what you should not have said.",you,,
"autocorrect just changed ""i have so much anxiety i can barely breathe"" to ""i'm fine.""",i,breathe,
"if i had a face like yours, i had / i would sue my parents.",i,,
behind every great man is a woman rolling her eyes.,,,
"roses are red, violets are blue, god made me pretty, what happened to you?",me,you,
"i refused to believe my road worker father was stealing from his job, but when i got home, all the signs were there.",i,but,
that awkward moment when you are about to hug someone sexy as hell and then you hit the mirror.,you,hug,
"a friend of mine tried to annoy me with bird puns, but i soon realized that toucan play at that game.",mine,bird,
"do not you love nature, despite what it did to you?",you,,
hell is wallpapered with all your deleted selfies.,your,,
you are the reason the gene pool needs a lifeguard.,you,,
your life does not get better by chance. it gets better by choice.,your,better,
you are slower than a herd of turtles stampeding through peanut butter.,you,,
my wife sent her photograph to the lonely hearts club. they sent it back saying they were not that lonely.,my,were not,
"if you can go to the gym without telling people on the internet, you are instantly hired by the cia.",you,without,
everywhere is walking distance if you have the time.,everywhere,,
what do you call a smart blonde? a golden retriever.,,,
nothing makes me more suspicious than an unsolicited compliment.,nothing,,
"i asked my wife what she wanted for christmas. she told me ""nothing would make her happier than a diamond necklace"" so i bought her nothing.",what,nothing,
"i am on a seafood diet. every time i see food, i eat it.",i,every,
"music makes every day better, especially if you turn it up just loud enough to drown out all the people around you.",every,you,
turtles think frogs are homeless.,,,
"when i get naked in the bathroom, the shower usually gets turned on.",i,,
"what dog can jump higher than a building? any dog, buildings can not jump!",what,any,can not
the last airline i flew charged for everything. except for the bad service. that was free.,i,everything,
"thieves had broken into my house and stolen everything except my soap, shower gel, and towels. dirty bastards.",my,everything,
"when i die, i hope i have enough time to point at a complete stranger and whisper ""you did this.""",i,point,whisper
success is like pregnancy. everybody congratulates you but nobody knows how many times you got fucked to achieve it.,everybody,nobody,achieve
makeup tip: you are not in the circus.,you,,
"so, a thought crossed your mind? must have been a long and lonely journey.",crossed,,
